{
  "name": "Singapore FinTech Festival",
  "year_started": 2016,
  "number_of_events_hosted": 9,
  "city": "Singapore",
  "region": "Central Region",
  "country": "Singapore",
  "continent": "Asia",
  "website": "https://www.fintechfestival.sg",
  "sector": [
    "FinTech",
    "Blockchain",
    "DeFi",
    "Security",
    "Digital Transformation"
  ],
  "tags": [
    "conference",
    "fintech",
    "blockchain"
  ],
  "acceptable_tags": [
    "fintech",
    "web3",
    "blockchain"
  ],
  "type": "in-person",
  "languages": [
    "English"
  ],
  "frequency": "annual",
  "timezone": "Asia/Singapore",
  "attendee_size": {
    "min": 30000,
    "max": 60000
  },
  "ticket_cost_usual": {
    "currency": "SGD",
    "min": 0,
    "max": 750
  },
  "organizer": {
    "name": "Elevandi (set up by Monetary Authority of Singapore)",
    "email": "",
    "twitter": "https://twitter.com/sgfintechfest",
    "website": "https://www.fintechfestival.sg"
  },
  "socials": {
    "twitter": "https://twitter.com/sgfintechfest",
    "linkedin": "https://www.linkedin.com/company/singapore-fintech-festival",
    "youtube": "https://www.youtube.com/channel/UCQNI-8DwtJWMFIfSUEOcijA",
    "instagram": "https://www.instagram.com/sgfintechfest"
  },
  "description": "Singapore FinTech Festival is one of the worldâ€™s largest fintech events, covering digital finance, Web3, payments, compliance, and innovation across Asia and globally."
}
